text_headline,text_description,latitude,longitude,media_url,media_caption,media_credit,date,background_color,background_opacity,type
Demo Storymapjs,"An example of StoryMapJS, using content from University of Idaho Library's <a href='https://www.lib.uidaho.edu/digital/stonebraker/about.html' target='_blank' rel='nofollow'>William Allen Stonebraker Photograph Collection</a>.",,,https://objects.lib.uidaho.edu/stonebraker/small/stonebraker149_sm.jpg,Hunting near the Clearwater River,"William Allen Stonebraker Photographs, Photo Group 26",,,,overview
From California,"William Allen Stonebraker was born in Adin, California, in 1879.",41.1938,-120.9452,https://objects.lib.uidaho.edu/stonebraker/small/stonebraker664_sm.jpg,Portrait of William Allen Stonebraker wearing a dark jacket.,"William Allen Stonebraker Photographs, Photo Group 26",,"#e31c1c",100,
To Chamberlain Basin,"In 1898, Al Stonebraker arrived in the Chamberlain Basin and was known as one of the original homesteaders in the area. He established a homestead on approximately 409 acres in what is now part of the Payette National Forest and the Frank Church-River of No Return wilderness, currently owned by Idaho Fish and Game.",45.3893561,-115.1976139,https://objects.lib.uidaho.edu/stonebraker/small/stonebraker623_sm.jpg,Distant view of Stonebraker Ranch,"William Allen Stonebraker Photographs, Photo Group 26",,,,
Packing for the gold rush,"Many of Al Stonebraker's businesses revolved around the Idaho mining boom at the turn of the twentieth century. The Chamberlain Basin homestead was originally built as a working ranch to supply beef to the mining communities along the Salmon River, and was one of the only ranches to exist after the mining boom in nearby Thunder Mountain. The Stonebraker property also included a mining prospect nearby for copper, gold and silver.",44.950188,-115.133438,https://objects.lib.uidaho.edu/stonebraker/small/stonebraker174_sm.jpg,Stonebraker pack train,"William Allen Stonebraker Photographs, Photo Group 26",,,,
Three Blaze Trail,"In 1900 Stonebraker and William Campbell were awarded the contract for location and construction of a trail from Grangeville to Dixie across the Salmon River and the Chamberlain Basin wilderness to the Monumental Creek trail, which led to Thunder Mountain. Named the Three Blaze Trail, the route met the Salmon River on the river's north bank, about twelve miles southeast of Dixie.",45.484623,-115.338667,https://objects.lib.uidaho.edu/stonebraker/small/stonebraker507_sm.jpg,"A scenic view of the river rounding a bend near Campbell's Ferry","William Allen Stonebraker Photographs, Photo Group 26",,,,